Question,Answer
What is the primary focus of descriptive analytics in supply chain management?,The primary focus of descriptive analytics in supply chain management is to summarize historical data to understand what has happened in the past.
Name one key metric used in measuring forecast accuracy.,Mean Absolute Deviation (MAD) is a key metric used in measuring forecast accuracy.
What is the main purpose of predictive analytics in supply chain management?,The main purpose of predictive analytics in supply chain management is to analyze historical data to make predictions about future events.
What is Time Series Forecasting?,Time Series Forecasting involves using historical data points to predict future values in a time series.
What is the role of prescriptive analytics in supply chain management?,Prescriptive analytics in supply chain management involves using optimization and simulation techniques to recommend actions for future decisions.
What is the significance of Mean Squared Error (MSE) in forecast accuracy?,"Mean Squared Error (MSE) measures the average of the squares of the errors, indicating the quality of a forecast; lower values mean better accuracy."
How does exponential smoothing help in forecasting?,"Exponential smoothing helps in forecasting by giving more weight to recent observations, making the forecast more responsive to changes."
What is a 'time series' in the context of forecasting?,A 'time series' is a sequence of data points collected or recorded at regular time intervals.
What is the importance of data visualization in descriptive analytics?,Data visualization in descriptive analytics is important for summarizing and presenting data in a visually appealing way to facilitate understanding.
What does 'bias' mean in the context of forecasting?,"In forecasting, 'bias' refers to the tendency of a forecast to consistently overpredict or underpredict the actual values."
Define 'Linear Regression' in the context of machine learning.,Linear Regression in machine learning is a method for predicting a dependent variable's value based on one or more independent variables.
What is 'Double Exponential Smoothing' used for?,"Double Exponential Smoothing is used for time series data that exhibits trends, smoothing both the level and the trend of the series."
Why is Mean Absolute Percentage Error (MAPE) useful?,"MAPE is useful as it provides a clear indication of the accuracy of forecasts in percentage terms, making it easy to interpret and compare."
What is the significance of Theil’s U-statistic in forecasting?,Theil's U-statistic measures the accuracy of a forecast model; values closer to 0 indicate a more accurate model.
How do inventory management techniques contribute to supply chain efficiency?,"Inventory management techniques help in balancing stock levels against demand, reducing costs, and improving customer satisfaction."
What is the purpose of network design in supply chain management?,Network design in supply chain management involves determining the most efficient and effective layout of a supply chain's logistics and facilities.
Why is transportation planning critical in supply chain management?,"Transportation planning is critical in supply chain management for optimizing the movement of goods, reducing costs, and improving service levels."
What role does machine learning play in supply chain analytics?,"Machine learning in supply chain analytics helps in identifying patterns, predicting future trends, and making data-driven decisions."
What are the advantages of using R for data visualization in supply chain analytics?,"Using R for data visualization offers advantages like advanced graphical capabilities, flexibility, and integration with various data sources."
How does simulation modeling benefit supply chain decision-making?,Simulation modeling benefits supply chain decision-making by allowing the testing of different scenarios and strategies without real-world risks.
What is the purpose of supply chain analytics in logistics and supply chain management?,"Supply chain analytics in logistics and supply chain management is used to distill complex data into actionable insights, aiding in strategic and data-driven decision-making."
How can data visualization improve decision-making in supply chain management?,"Data visualization transforms complex supply chain data into easily understandable formats, helping professionals identify patterns, forecast outcomes, and align strategies with business objectives."
What is the role of the Strategic Profit Model in supply chain analytics?,"The Strategic Profit Model (SPM) links supply chain activities with a company's financial performance, particularly focusing on how supply chain decisions influence financial health, like Return on Assets (ROA)."
Why are forecasting methods important in supply chain analytics?,"Forecasting methods in supply chain analytics are essential for predicting future demand, supply levels, and capacity requirements, which are vital for enhancing efficiency and responsiveness of the supply chain."
"What is the difference between descriptive, predictive, and prescriptive analytics in supply chain management?","Descriptive analytics describe the current state of the supply chain, predictive analytics forecast future outcomes, and prescriptive analytics provide recommendations on actions in uncertain situations."
How does the Naïve forecasting method work in supply chain analytics?,"The Naive forecasting method simply uses the most recent period's actual demand as the forecast for the next period, assuming the latest data point is the most relevant for future prediction."
What is the importance of responsible data visualization in supply chain management?,"Responsible data visualization in supply chain management ensures that information is presented honestly and fairly, avoiding misleading representations that could lead to poor decision-making."
What are the key components of creating effective supply chain dashboards?,"Effective supply chain dashboards should be user-specific, align with business objectives, present relevant metrics, and be constructed and tested with appropriate software tools."
How does predictive analytics contribute to supply chain management?,"Predictive analytics in supply chain management helps anticipate future trends and patterns, enabling proactive strategies for demand, supply levels, and capacity planning."
Why is understanding the present state crucial in supply chain analytics?,"Understanding the present state is essential for identifying current achievements, challenges, and forming a basis for improvement and strategic planning in supply chain management."
What role does machine learning play in supply chain analytics?,"Machine learning in supply chain analytics is used for complex data analysis, pattern recognition, and making predictions, enhancing decision-making processes in logistics and supply chain management."
How does the Cumulative Mean forecasting method work in supply chain analytics?,"The Cumulative Mean method calculates forecasts by averaging all previous demand observations, providing a running average that accounts for all past data in decision-making."
What are the ethical considerations in data visualization for supply chain analytics?,"Ethical considerations include ensuring honesty, fairness, and avoiding misleading representations, as visualization in supply chain analytics can significantly impact decision-making."
How do qualitative forecasting methods like the Delphi Method work in supply chain analytics?,"Qualitative methods like the Delphi Method involve gathering expert opinions through several rounds of surveys and discussions to reach a consensus forecast, useful for long-range planning and new product introduction."
What is the significance of the Jury of Executive Opinion in supply chain forecasting?,"The Jury of Executive Opinion method utilizes the collective knowledge and experience of senior executives to develop forecasts, valuable for aggregate forecasting and long-range planning."
How do consumer surveys and focus groups contribute to forecasting in supply chain analytics?,"Consumer surveys and focus groups gather direct customer insights on purchasing needs and opinions, aiding in demand forecasting, especially for new product introductions."
What are the benefits and drawbacks of using the Naïve forecasting method in supply chain management?,"The Naive method is simple and quickly reacts to changes in actual demand, but may be inaccurate if there is significant variation, best suited for stationary demand patterns."
Why is revenue a critical performance metric in the Strategic Profit Model for supply chain analytics?,"Revenue is crucial in the Strategic Profit Model as it directly impacts the Profit Margin component, influencing a company's Return on Assets and highlighting the effect of supply chain decisions on financial performance."
How does inventory management impact the Strategic Profit Model in supply chain analytics?,"Effective inventory management can improve the Current Assets and Total Assets components in the Strategic Profit Model, leading to higher Asset Turnover and ultimately enhancing Return on Assets."
What is the importance of time series methods in quantitative forecasting for supply chain analytics?,"Time series methods in quantitative forecasting analyze historical demand data for systematic variation and use it to predict future demand, essential for planning inventory, production, and distribution."
How do heuristics contribute to supply chain decision-making?,"Heuristics provide simplified decision rules or shortcuts in complex supply chain scenarios, enabling faster decision-making, especially in situations where precise optimization is not feasible or necessary."
What is the role of causal modeling in supply chain forecasting?,"Causal modeling in supply chain forecasting involves identifying and quantifying relationships between different variables (like promotional activities and sales), aiding in understanding and predicting demand patterns."
How does the application of AI and ML in logistics and supply chain management enhance analytics?,"AI and ML in logistics and supply chain management allow for more advanced data analysis, pattern recognition, and prediction capabilities, enhancing the accuracy and efficiency of decision-making processes."
Why is understanding the 'present state' in supply chain analytics important for future planning?,"Understanding the present state provides insights into current performance, challenges, and achievements, forming a baseline for planning improvements and future strategies."
What are the challenges and considerations in applying predictive analytics in supply chain management?,"Challenges in applying predictive analytics include data quality, model selection, and the balance between complexity and usability, with considerations around accuracy, interpretability, and applicability to real-world scenarios."
What is supply chain analytics?                                      ," It involves applying statistical methods and technologies to extract meaningful insights from supply chain operations to drive improvements, increase efficiencies, and support informed decisions.                                                                                              "
Name three types of supply chain analytics.                          ," Descriptive, Predictive, and Prescriptive Analytics - explaining trends, predicting future events, and recommending best courses of action, respectively.                                                                                                                                        "
How does Data Mining aid supply chain analytics?                     ," Data mining uncovers hidden patterns and relationships in large datasets, allowing strategic insights and targeted improvements.                                                                                                                                                                 "
Define 'Demand Forecasting.'                                         ," Estimating future demand for products based on historical sales data, industry trends, and external factors.                                                                                                                                                                                     "
Explain the significance of Lead Time Reduction in SC Analytics.     ," Shorter lead times enable faster responses to changing demands, reducing safety stocks and minimizing operational costs.                                                                                                                                                                         "
How is Machine Learning used in supply chain analytics?              ," ML automates complex analytical tasks and creates accurate predictions, enabling continuous improvement and adaptability in dynamic environments.                                                                                                                                                "
Describe the importance of Key Performance Indicators (KPIs)         , KPIs measure progress against goals and inform stakeholders of successes or challenges; common in SC Analytics. KPIs include On-Time Delivery Rate and Perfect Order Percentage.                                                                                                                 
What advantages come from integrating IoT devices in supply chains?  ," Real-time monitoring, enhanced traceability, automated processes, reduced waste, and greater efficiency are some benefits gained from incorporating IoT technology.                                                                                                                              "
Briefly discuss Blockchain's impact on supply chain analytics.       ," Enhances security, visibility, and collaboration among partners via decentralized digital ledgers, promoting transparency and integrity.                                                                                                                                                         "
What role do Simulation Models play in supply chain analysis?        ," They mimic real-life systems to test alternatives, evaluate risks, and determine ideal strategies before implementation, saving resources and facilitating innovation adoption.                                                                                                                  "
Why focus on Customer Segmentation in supply chain analytics?        ," Customized solutions catering to distinct buyer groups maximize revenue growth, resource allocation effectiveness, and competitive advantage.                                                                                                                                                    "
How can Risk Assessment benefit from supply chain analytics?         ," Proactive identification of vulnerabilities, weak links, and threats reduces negative impacts, encourages preparedness, and ensures continuity plans are developed and tested regularly.                                                                                                         "
Discuss the effect of Big Data on supply chain analytics.            ," The availability of massive amounts of diverse, structured, and unstructured data empowers organizations to discover granular insights, develop personalized offerings, refine pricing strategies, and elevate customer experiences.                                                             "
Mention two ways AI contributes to supply chain analytics.           ," Algorithms streamline repetitive manual work, augment human expertise, and detect anomalies, leading to faster decision making, higher precision, and customization capabilities.                                                                                                                "
How does Green Supply Chain Management relate to SC Analytics?       ," GSCM focuses on implementing ecological policies and procedures to minimize environmental footprint, promote sustainability, and adhere to regulatory compliance standards, aligning with broader organizational objectives and increasing profitability.                                        "
Elaborate on the importance of Sales & Operations Planning (S&OP).   ," A cross-functional process synchronizing marketing, production, finance, and distribution efforts, ensuring alignment and buy-in around shared targets and execution tactics, driving cohesion and consistency.                                                                                  "
How does Technology Adoption influence supply chain analytics?       ," Digitization transforms traditional siloed functions into interconnected networks, bolstering cooperation, standardization, automation, scalability, and innovation diffusion, resulting in substantial productivity gains, cost savings, and service excellence.                                "
Explain the function of Network Design Optimization in SC Analytics. ," NDO seeks to strategically position facilities, warehouses, and transportation nodes to optimize capacity, routing, and flow, yielding lowest total landed costs, highest asset utilization, and shortest lead times.                                                                            "
Highlight the relevance of Talent Development in SC Analytics.       ," Human capital upskilling strengthens technical competency, problem solving abilities, and change management proficiency, empowering personnel to effectively navigate evolving landscapes, embrace emerging tools, and innovate continuously.                                                    "
Summarize the purpose of Total Cost of Ownership (TCO) Analysis.     ," TCO quantifies direct and indirect expenditures associated with acquiring, deploying, maintaining, and disposing assets or services, guiding sourcing teams to select options delivering superior long term value, accounting for quality, durability, tax implications, and aftermarket support."
"What are the main types of analytical models used in supply chain analytics, and how do they differ?","The main types of analytical models in supply chain analytics are descriptive, predictive, and prescriptive. Descriptive models analyze past data to understand what has happened, predictive models use data to forecast future outcomes, and prescriptive models suggest actions based on data analysis."
How can logistics and supply chain management leverage predictive analytics?,"Predictive analytics in logistics and supply chain management is used to forecast future demand, supply levels, and capacity requirements, enhancing efficiency and agility of the supply chain."
What skills are important for making a compelling business case in supply chain analytics?,"Key skills for making a compelling business case in supply chain analytics include the ability to translate analytical findings into actionable insights, knowledge of statistical methods, computer modeling, and data visualization, and the ability to align recommendations with business objectives."
What is the significance of understanding the present state in supply chain decision-making?,"Understanding the present state is crucial as it reflects the cumulative result of past decisions, achievements, challenges, and it forms the baseline from which future improvements and strategies are developed."
What is the role of a supply chain analyst in network design and optimization?,"A supply chain analyst in network design and optimization analyzes procurement operations and logistics decisions, evaluates distribution networks, and recommends strategies for optimal configuration and efficiency."
How are supply chain dashboards utilized in logistics and supply chain management?,"Supply chain dashboards are used to monitor various operations, identify patterns and trends, and enable data-driven decision-making. They often incorporate multiple visualizations to display metrics that provide a comprehensive view of the supply chain."
What factors should be considered when designing a supply chain dashboard?,"When designing a supply chain dashboard, it's important to know the audience, map supply chain objectives to business goals, and choose metrics that reflect these objectives and strategies."
How do prescriptive analytics contribute to supply chain management?,"Prescriptive analytics in supply chain management identifies the best possible outcomes in a given situation, guiding decision-making and strategic planning."
What is the difference between true optimization models and near-optimization models in supply chain analytics?,"True optimization models provide mathematically proven optimal solutions, while near-optimization models use heuristic methods to find 'good enough' solutions."
"What is the Economic Order Quantity (EOQ) model, and how is it used in supply chain optimization?",The Economic Order Quantity (EOQ) model is used to determine the optimal order quantity that minimizes the sum of inventory carrying costs and ordering costs in supply chain optimization.
How does demand forecasting impact facility location decisions in supply chain management?,"Demand forecasting impacts facility location decisions by predicting future demand levels and growth in different geographical markets, influencing where to build or buy new distribution centers."
What is the importance of forecasting in managing inventory and transportation in supply chains?,"Forecasting is essential for planning inventory replenishment, transportation routing, and managing risks associated with inventory shortages or overproduction."
How can machine learning (ML) be applied in logistics and supply chain management?,"Machine learning in logistics and supply chain management can be used to detect patterns in large data sets, improve decision-making, and gain competitive advantages in areas like demand forecasting and transportation optimization."
What role does the order fulfillment process play in generating data for machine learning applications?,"The order fulfillment process integrates manufacturing, logistics, and marketing activities, creating large data sets related to orders and transportation that are amenable to machine learning analysis."
How can the data generated from supply chain management processes be used for predictive analytics?,"Data from supply chain management processes can be used to predict outcomes such as demand levels, transportation efficiency, and customer behavior, aiding in strategic planning and operational improvements."
How can continuous improvement be achieved in a supply chain using analytics?,"Continuous improvement in a supply chain can be achieved by using analytics to sense market changes, make informed decisions, and strategize improvements based on the analysis of the present and future states."
What is the process of making a business case using logistics and supply chain analytics?,"Making a business case using logistics and supply chain analytics involves measuring the present and future states of the supply chain, calculating differences, developing a plan for achieving the future state, and assessing risks."
How do analytics help in understanding the impact of supply chain decisions on order fulfillment times?,"Analytics can be used to measure current order fulfillment times and predict the impact of various supply chain decisions on improving these times, thereby aiding in strategic planning and operational efficiency."
What are the five steps in making a business case using supply chain analytics?,"The five steps are: measuring the present state of the supply chain, measuring the future state, calculating the differences between these states, developing a plan to achieve the future state, and assessing potential risks."
How can supply chain analytics be used to optimize inventory management and transportation planning?,"Supply chain analytics can be used to analyze demand patterns, optimize inventory levels, plan efficient transportation routes, and make informed decisions to enhance overall supply chain performance."